{
  "snapshotVersion": "1",
  "envelope": {
    "documentVersion": "1",
    "profileIdentity": {
      "mechanismVersion": "1",
      "schemaVersion": "1.0.0",
      "profile": "ui-neutral/1",
      "version": "1.1.0",
      "sha256": "217aed39fa21ede481945f0cf5b899e5424725ead193136b201a8051e2d3986e",
      "base": {
        "id": "ui-neutral-base/1",
        "version": "lot5-2",
        "sha256": "eabe8ae63be94d2ecfd8873651d9aa24089b438726b048be72f9f4e00be9adbb"
      },
      "descriptors": [
        {
          "id": "ui-neutral-descriptors/1",
          "version": "lot5-2",
          "sha256": "59f956064d24508d071e0a2f4cddb91a6f764bbb82b751234def3e63ffde4032"
        }
      ]
    },
    "tree": {
      "$type": "bpmn:Definitions",
      "id": "Defs_other",
      "targetNamespace": "urn:example:lot5-other",
      "exporterVersion": "ui-neutral-base/1",
      "rootElements": [
        {
          "$type": "bpmn:Process",
          "id": "Proc_other",
          "name": "Other process",
          "isExecutable": false,
          "flowElements": [
            {
              "$type": "bpmn:StartEvent",
              "id": "Start_o",
              "name": "Other start"
            }
          ]
        }
      ]
    },
    "bindings": [],
    "semanticRevision": "20a32271817608b490f9147ea4cfeb9dc00bc4eca8420465ce59fe334f8185a2"
  },
  "presentation": {
    "layout": {
      "layoutVersion": "1",
      "pages": [
        {
          "pageId": "page-other",
          "name": "Other process",
          "order": 0,
          "semanticRootId": "Proc_other",
          "bounds": {
            "x": 0,
            "y": 0,
            "width": 800000,
            "height": 400000
          }
        }
      ],
      "geometry": [
        {
          "pageId": "page-other",
          "occurrenceKey": "occ:Start_o",
          "semanticId": "Start_o",
          "role": "content",
          "bounds": {
            "x": 100000,
            "y": 100000,
            "width": 36000,
            "height": 36000
          }
        }
      ]
    },
    "themeId": "plain",
    "overrides": {
      "semantic": [],
      "occurrence": []
    },
    "diStyles": {
      "native": [],
      "bioc": []
    },
    "importedDi": {
      "descriptorDigest": "93b334bc67d76f4b26eb3d501871cc2dadcafab09c484d2d2b0f7a0d01a1a6e6",
      "diagrams": [],
      "sha256": "86227d990ce21f749bf18cf2062993e79f8b0012e612bf33d5891d3dc3076a52"
    },
    "selection": [],
    "activePageId": "page-other"
  },
  "viewRevision": "65c62481d07d8f98c992c6bce7aa2ee07ad8cd22f00a7189dd0d8a9ca51cd4f1"
}
